"DESCRIPTION","DURATION IN MS","NAME","PARENT SUITE","START TIME","STATUS","STOP TIME","SUB SUITE","SUITE","TEST CLASS","TEST METHOD"
"/home/runner/work/immunisation-fhir-api/immunisation-fhir-api/tests/e2e_automation/features/batchTests/update_batch.feature: Update immunization event for a patient through batch file","47010","Update immunization event for a patient through batch file","features.batchTests.Steps","Tue Feb 10 16:05:14 UTC 2026","passed","Tue Feb 10 16:06:01 UTC 2026","","Create the immunization event for a patient through batch file and update the record from batch or Api calls","",""
"/home/runner/work/immunisation-fhir-api/immunisation-fhir-api/tests/e2e_automation/features/batchTests/create_batch.feature: Verify that minimum dataset vaccination record will be created through batch file","49506","Verify that minimum dataset vaccination record will be created through batch file","features.batchTests.Steps","Tue Feb 10 16:03:48 UTC 2026","passed","Tue Feb 10 16:04:37 UTC 2026","","Create the immunization event for a patient through batch file","",""
"/home/runner/work/immunisation-fhir-api/immunisation-fhir-api/tests/e2e_automation/features/batchTests/update_batch.feature: Verify API succeeds while batch upload fails due to missing mandatory fields and duplicate record","52641","Verify API succeeds while batch upload fails due to missing mandatory fields and duplicate record","features.batchTests.Steps","Tue Feb 10 16:06:01 UTC 2026","passed","Tue Feb 10 16:06:54 UTC 2026","","Create the immunization event for a patient through batch file and update the record from batch or Api calls","",""
"/home/runner/work/immunisation-fhir-api/immunisation-fhir-api/tests/e2e_automation/features/batchTests/batch_file_validation.feature: verify that vaccination file will be rejected if file delimiter is invalid","60395","verify that vaccination file will be rejected if file delimiter is invalid","features.batchTests.Steps","Tue Feb 10 16:01:53 UTC 2026","passed","Tue Feb 10 16:02:53 UTC 2026","","Validate the file level and columns validations for vaccination batch file","",""
"/home/runner/work/immunisation-fhir-api/immunisation-fhir-api/tests/e2e_automation/features/batchTests/create_batch.feature: Verify that full dataset vaccination record will be created through batch file","54572","Verify that full dataset vaccination record will be created through batch file","features.batchTests.Steps","Tue Feb 10 16:02:53 UTC 2026","passed","Tue Feb 10 16:03:48 UTC 2026","","Create the immunization event for a patient through batch file","",""
"/home/runner/work/immunisation-fhir-api/immunisation-fhir-api/tests/e2e_automation/features/batchTests/delete_batch.feature: Delete immunization event for a patient through batch file","37201","Delete immunization event for a patient through batch file","features.batchTests.Steps","Tue Feb 10 16:04:37 UTC 2026","passed","Tue Feb 10 16:05:14 UTC 2026","","Create the immunization event for a patient through batch file and update the record from batch or Api calls","",""
"/home/runner/work/immunisation-fhir-api/immunisation-fhir-api/tests/e2e_automation/features/batchTests/batch_file_validation.feature: verify that vaccination file will be rejected if column order is invalid","72504","verify that vaccination file will be rejected if column order is invalid","features.batchTests.Steps","Tue Feb 10 16:00:40 UTC 2026","passed","Tue Feb 10 16:01:53 UTC 2026","","Validate the file level and columns validations for vaccination batch file","",""
